{
  "$schema": "https://json-schema.org/draft/2020-12/schema",
  "$id": "https://schemas.kumwe.org/studio/v1/media-vector.schema.json",
  "title": "Studio canonical media policy vector",
  "description": "One canonical upload-policy decision: a host-declared policy, an upload request, and either the deterministic policy-derived plan or a stable failure code, optionally extended with cancellation and retry legality for the media-upload-session state machine.",
  "type": "object",
  "additionalProperties": false,
  "required": ["contractVersion", "kind", "id", "description", "policy", "request", "expect"],
  "properties": {
    "contractVersion": { "$ref": "common.schema.json#/$defs/contractVersion" },
    "kind": { "const": "media-vector" },
    "id": { "$ref": "common.schema.json#/$defs/stableId" },
    "description": {
      "type": "string",
      "minLength": 1,
      "maxLength": 500
    },
    "policy": {
      "type": "object",
      "additionalProperties": false,
      "required": ["acceptedMediaTypes", "maximumBytes", "resumable"],
      "properties": {
        "acceptedMediaTypes": {
          "type": "array",
          "minItems": 1,
          "maxItems": 100,
          "items": { "$ref": "#/$defs/mediaType" }
        },
        "chunkBytes": { "type": "integer", "minimum": 1024, "maximum": 1073741824 },
        "maximumBytes": { "type": "integer", "minimum": 1, "maximum": 1099511627776 },
        "resumable": { "type": "boolean" }
      }
    },
    "request": {
      "type": "object",
      "additionalProperties": false,
      "required": ["filename", "mediaType", "byteSize", "purpose"],
      "properties": {
        "filename": {
          "description": "Deliberately looser than the media-upload-session request shape so rejection vectors can carry filenames the canonical contract refuses.",
          "type": "string",
          "maxLength": 500
        },
        "mediaType": { "$ref": "#/$defs/mediaType" },
        "byteSize": { "type": "integer", "minimum": 1, "maximum": 1099511627776 },
        "purpose": { "$ref": "common.schema.json#/$defs/qualifiedName" },
        "checksum": { "$ref": "common.schema.json#/$defs/integrity" }
      }
    },
    "expect": {
      "oneOf": [
        {
          "type": "object",
          "additionalProperties": false,
          "required": ["outcome", "plan"],
          "properties": {
            "outcome": { "const": "accepted" },
            "plan": { "$ref": "#/$defs/plan" }
          }
        },
        {
          "type": "object",
          "additionalProperties": false,
          "required": ["outcome", "code"],
          "properties": {
            "outcome": { "const": "rejected" },
            "code": { "$ref": "#/$defs/failureCode" },
            "messageMustNotContain": {
              "description": "Raw request or policy values the user-facing failure message MUST NOT echo.",
              "type": "array",
              "minItems": 1,
              "maxItems": 10,
              "items": {
                "type": "string",
                "minLength": 1,
                "maxLength": 200
              }
            }
          }
        }
      ]
    },
    "cancel": {
      "description": "Cancellation legality: the session state during which cancel() is issued and the resulting terminal state. Cancellation from an active state ends in cancelled; cancellation after completion is a no-op.",
      "type": "object",
      "additionalProperties": false,
      "required": ["during", "finalState"],
      "properties": {
        "during": { "enum": ["complete", "requested", "transferring", "verifying"] },
        "finalState": { "enum": ["cancelled", "complete"] }
      }
    },
    "retry": {
      "description": "Retry legality for a rejected request: retry is legal only from the failed state and always runs under a fresh session identity with the identical request.",
      "type": "object",
      "additionalProperties": false,
      "required": ["freshSession"],
      "properties": {
        "freshSession": { "const": true }
      }
    }
  },
  "$defs": {
    "failureCode": {
      "enum": ["studio.media/upload-failed", "studio.media/upload-too-large"]
    },
    "mediaType": {
      "type": "string",
      "pattern": "^[a-z0-9][a-z0-9!#$&^_.+-]*/[a-z0-9][a-z0-9!#$&^_.+-]*(?![\\s\\S])",
      "maxLength": 120
    },
    "plan": {
      "type": "object",
      "additionalProperties": false,
      "required": ["maximumBytes", "resumable"],
      "properties": {
        "maximumBytes": { "type": "integer", "minimum": 1, "maximum": 1099511627776 },
        "chunkBytes": { "type": "integer", "minimum": 1024, "maximum": 1073741824 },
        "resumable": { "type": "boolean" }
      }
    }
  }
}
