{
  "contractVersion": "0.1-draft",
  "kind": "media-vector",
  "id": "vector.media-vector.cancel.requested",
  "description": "Cancelling while the session is still requested — before the host answers authorization — is legal and ends the session in cancelled without any transfer.",
  "policy": {
    "acceptedMediaTypes": ["image/jpeg", "image/png"],
    "chunkBytes": 1024,
    "maximumBytes": 4096,
    "resumable": true
  },
  "request": {
    "filename": "cancelled-early.jpg",
    "mediaType": "image/jpeg",
    "byteSize": 2000,
    "purpose": "studio.media/entry-image"
  },
  "expect": {
    "outcome": "accepted",
    "plan": {
      "maximumBytes": 4096,
      "chunkBytes": 1024,
      "resumable": true
    }
  },
  "cancel": {
    "during": "requested",
    "finalState": "cancelled"
  }
}
