{
  "contractVersion": "0.1-draft",
  "kind": "media-vector",
  "id": "vector.media-vector.retry.fresh-session",
  "description": "Retrying a failed upload is legal only from the failed state and always runs under a fresh session identity with the identical request; a deterministic policy rejection therefore repeats identically.",
  "policy": {
    "acceptedMediaTypes": ["image/jpeg", "image/png"],
    "chunkBytes": 1024,
    "maximumBytes": 4096,
    "resumable": true
  },
  "request": {
    "filename": "clip.mp4",
    "mediaType": "video/mp4",
    "byteSize": 2048,
    "purpose": "studio.media/entry-image"
  },
  "expect": {
    "outcome": "rejected",
    "code": "studio.media/upload-failed",
    "messageMustNotContain": ["video/mp4"]
  },
  "retry": {
    "freshSession": true
  }
}
