{
  "contractVersion": "0.1-draft",
  "kind": "media-vector",
  "id": "vector.media-vector.cancel.verifying",
  "description": "Cancelling while the host verifies the transferred bytes is legal: the session ends in cancelled and never reports an accepted asset.",
  "policy": {
    "acceptedMediaTypes": ["image/jpeg", "image/png"],
    "chunkBytes": 1024,
    "maximumBytes": 4096,
    "resumable": true
  },
  "request": {
    "filename": "cancelled-verifying.png",
    "mediaType": "image/png",
    "byteSize": 2048,
    "purpose": "studio.media/entry-image"
  },
  "expect": {
    "outcome": "accepted",
    "plan": {
      "maximumBytes": 4096,
      "chunkBytes": 1024,
      "resumable": true
    }
  },
  "cancel": {
    "during": "verifying",
    "finalState": "cancelled"
  }
}
